{
  "type": "brewing:equipment",
  "schema_version": 1,
  "id": "brewing:wooden_fermenter",
  "name_key": "brewing.equipment.wooden_fermenter.name",
  "rarity": "common",
  "material": "wood",
  "function": "fermentation",
  "category": "equipment",

  "placement": {
    "kind": "block",
    "block_id": "brewing:wooden_fermenter_block",
    "block_entity_id": "brewing:wooden_fermenter_entity",
    "facing": "north",
    "requires_solid_support": true
  },

  "inventory": {
    "capacity": 3,
    "stack_limit_per_slot": 64,
    "accepts_item_tags": ["brewing:fermentables"],
    "rejects_item_tags": [],
    "slot_roles": {
      "0": "input",
      "1": "input",
      "2": "yeast"
    },
    "quick_move": {
      "enabled": true,
      "priority": ["yeast", "input"]
    }
  },

  "aging": {
    "recipe_source": "brewing:fermentation",
    "recipe_type": "brewing:fermenter_recipe",
    "aging_multiplier": 1.0,
    "progress_persists": true
  },

  "upgrades": {
    "enabled": true,
    "slots": 1,
    "allowed_upgrade_tags": ["brewing:fermenter_upgrades"],
    "effects": {}
  },

  "client": {
    "screen_id": "brewing:fermenter_screen",
    "show_progress": true,
    "show_quality": false,
    "show_environment_state": false
  },

  "gates": {
    "requires_feature_flag": "brewing:enabled",
    "requires_gamerule_true": "brewingEnabled"
  }
}
